130,显瘦秋装新款百搭高腰牛仔裤秋季小脚长裤女裤子2017学生潮韩版夏价格：99,音棉旗舰店,104,104,16,//yinmian.tmall.com,137,152,152,145,454,405,139,492,435,447,405,416,394,445
131,2017秋季弹力高腰牛仔裤女深色紧身小脚裤长裤大码修身女裤春秋潮价格：138,澜克利莎旗舰店,104,105,23,//lankelisha.tmall.com,165,161,161,454,165,492,457,463,440,489,141,489,420,446
132,黑色高腰显瘦女士牛仔裤女夏2017新款韩版百搭铅笔小脚裤九分裤子价格：138,开阔服饰旗舰店,103,103,18,//kaikuo.tmall.com,444,432,432,451,421,457,284,268,,296,303,476,280,451
133,牛仔裤女高腰九分小脚裤弹力显瘦2017新款百搭学生铅笔长裤子大码价格：268,媚倍儿旗舰店,103,103,20,//meibeier.tmall.com,,,,442,,,317,359,478,483,275,478,396,452
134,自制夏季个性牛仔裤2017韩国百搭阔腿裤女高腰基础休闲裤翻边长裤价格：79.9,馨帮帮sinbounboun,103,104,12,//sinbounboun.taobao.com,,,,,,,,,,,,,,448
135,2017秋冬季弹力中腰九分牛仔裤女深色紧身小脚裤长裤大码修身最新价格：68,苏安丽t旗店,103,103,76,//shop115692071.taobao.com,273,414,414,,,,,,,,415,383,302,416
136,高腰牛仔裤女2017秋新款弹力显瘦九分裤烟灰色小脚铅笔长裤韩版潮价格：39.9,liujunzhanlan,102,103,29,//baiyulan.taobao.com,,,,,,,,,368,361,351,246,145,458
137,韩版高腰牛仔裤女小脚长裤2017新款学生九分裤弹力修身显瘦铅笔裤价格：198,北艾旗舰店,102,118,42,//beiainz.tmall.com,,,,,,,,,,,,,339,455
138,春夏季新款牛仔裤女女式高腰小脚韩版显瘦中学生松紧腰带加长裤子价格：98,好酷风好牛仔,102,104,15,//yyc8888.taobao.com,193,173,173,423,479,498,440,472,488,482,379,411,424,456
139,春季韩国显瘦紧身烟灰色膝盖破洞牛仔裤女铅笔裤做旧小脚裤九分裤价格：138,艾恺铭原创,101,101,16,//zhouxiaoqi168.taobao.com,221,268,268,261,417,434,470,294,313,344,442,318,347,425
140,复古港味修身显瘦膝盖破洞牛仔裤女九分裤弹力百搭小脚裤铅笔裤子价格：39,港妹潮人馆,101,101,17,//bazhaoyi.taobao.com,231,224,224,197,486,216,434,461,475,461,302,209,246,462
141,海熙2017夏款薄款磨破高腰牛仔短裤女韩版破洞阔腿宽松显瘦热裤潮价格：155,海熙旗舰店,100,100,15,//haixi.tmall.com,,3,3,6,64,194,254,,,3,20,15,123,429
142,拉贝缇2017夏装新款高腰简约休闲牛仔裤丹宁小脚裤女九分裤价格：199,lababite官方旗舰店,100,103,14,//lababite.tmall.com,51,345,345,,,,,89,,,,,59,232
143,森马直筒牛仔裤女 2017夏季新款 学生弹力韩版时尚修身小脚八分裤价格：199,森马官方旗舰店,100,103,21,//semir.tmall.com,436,,,351,233,376,,,,,,,,427
144,【8.8新品  9折+包邮】丢丢韩版黑色脚口毛边小脚裤价格：135,DIUDIU ROOM 丢丢定制,99,99,24,//honey-diudiu.taobao.com,,,,,,,,,,,,,,470
145,牛仔裤女春夏季修身显瘦韩版紧身弹力高腰收腹学生铅笔百搭长裤子价格：98,揭阳泽宏贸易有限公司,99,99,14,//shop187860957.taobao.com,,,,,,,,,,,,,,471
146,牛仔短裤女夏季2017新款韩版百搭弹力磨破洞显瘦学生毛边热裤子潮价格：168,怜雪服饰旗舰店,97,97,26,//lianxuefs.tmall.com,342,383,383,385,316,435,375,393,434,360,275,432,342,478
147,菲己2017秋黑色修身开叉九分裤学生韩版显瘦流苏牛仔裤女紧身小脚价格：189,菲己旗舰店,97,97,34,//feijitz.tmall.com,,,,,,,,,,,,,,242
148,2017新款夏季女士牛仔短裤韩版少女宽松白色热裤破洞百搭松紧外穿价格：168,婕恋旗舰店,97,97,20,//jielian.tmall.com,332,4,4,244,193,193,225,316,283,295,466,325,237,283
149,2017新款破洞牛仔裤女夏季韩版小脚显瘦百搭九分裤黑色学生长裤子价格：168,靡格旗舰店,97,97,20,//migenz.tmall.com,319,472,472,,485,481,477,,,,481,334,437,486
150,弹力修身高腰牛仔裤女大码胖mm小脚长裤秋季黑色铅笔裤春秋薄款潮价格：96,澜克利莎旗舰店,97,97,23,//lankelisha.tmall.com,120,142,142,476,469,157,400,482,160,442,133,417,448,480
151,渔网破洞烂牛仔裤女夏九分裤秋季韩版显瘦小脚裤子2017秋装新款潮价格：99,恋人心服饰旗舰店,96,96,18,//lianrenxinfs.tmall.com,408,433,433,406,438,461,488,433,490,476,439,479,312,490
152,Alice&amp;amp;W  破洞牛仔裤女长裤春夏季2017新款修身小脚裤铅笔裤价格：232,Alice wang潮流女装,95,97,16,//huahua868.taobao.com,178,190,190,171,129,147,204,144,265,160,219,257,359,496
153,2017夏秋新款九分牛仔裤女高腰黑色紧身显瘦小脚裤简约修身长裤子价格：49.9,胶己人的女装店,94,94,17,//shop113363827.taobao.com,,,,,,479,256,300,,285,440,301,469,497
154,谜团秋装牛仔裤女夏2017新款九分裤韩版薄款显瘦紧身小脚铅笔裤潮价格：199,谜团旗舰店,94,94,12,//mituan.tmall.com,339,348,348,400,458,429,319,276,246,253,305,291,273,498
155,3712 秋季新款韩版网格毛边破洞牛仔裤女高弹力开衩修身小脚裤潮价格：22.99,第六神话华玉美衣女装成衣性价比之王外贸批发零售,93,104,25,//thesixthmyths.taobao.com,,,,,,,,,,,,,,155
156,春夏季韩版高腰烂牛仔裤女破洞宽松显瘦九分裤女装乞丐小脚裤子潮价格：158,冬月L兮,92,92,20,//shop108206730.taobao.com,410,389,389,221,237,218,240,237,196,248,399,431,371,256
157,2017新款高腰牛仔裤女长裤收腹修身显瘦弹力松紧腰大码排扣小脚裤价格：128,媛范旗舰店,92,92,19,//yuanfannz.tmall.com,386,386,386,386,200,241,270,206,164,289,174,151,140,490
158,天天特价春季高腰牛仔裤女九分裤显瘦紧身蓝色弹力修身小脚铅笔裤价格：199,衣艺社日韩女装,92,92,14,//yiyisherihan.taobao.com,283,355,355,367,272,328,281,311,307,424,300,266,290,477
159,黑色高腰修身九分裤流苏毛边紧身铅笔小脚牛仔裤女夏2017新款长裤价格：118,smbath旗舰店,92,92,13,//smbath.tmall.com,,,,,,,,,,444,441,289,469,480
160,夏装女装新款韩版百搭修身牛仔裤高腰显瘦铅笔裤九分裤长裤小脚裤价格：39.98,可可里小姐,92,92,14,//misskkl.taobao.com,143,150,150,156,172,133,120,130,451,135,140,420,489,484
161,2017新款七分牛仔裤女小脚修身弹力高腰薄款中裤翻边百搭马裤女夏价格：299,柔伊美旗舰店,91,92,26,//rouyimei.tmall.com,160,229,229,187,446,247,242,234,266,481,165,435,454,165
162,黑色膝盖破洞牛仔裤女九分裤夏薄款韩版高腰显瘦不规则紧身小脚裤价格：128,GAG红人馆,91,92,21,//shop107223039.taobao.com,446,494,494,341,395,339,450,346,393,417,449,493,298,483
163,◆MUGU蘑菇◆破洞黑色牛仔裤女夏九分小脚弹力百搭高腰修身显瘦价格：142,MUGU STUDIO 蘑菇定制,91,91,11,//mugu520.taobao.com,,,,,,,,,,,,,482,487
164,森马牛仔裤女2017秋季新款韩版显瘦九分裤修身小脚裤bf风学生裤子价格：199,森马官方旗舰店,91,91,27,//semir.tmall.com,,,,435,423,,,,,,,,,488
165,CBC2017新款超高弹力夏季牛仔短裤女深蓝色卷边韩版修身显瘦热裤价格：218,cobcbc服饰旗舰店,91,91,21,//cobcbc.tmall.com,464,264,264,499,283,436,434,448,454,280,439,412,393,494
166,高腰黑色膝盖破洞牛仔裤女夏烂毛边韩版显瘦紧身小脚铅笔九分裤潮价格：299,Jeans 女装,90,90,18,//shop121404425.taobao.com,,,,,,,419,431,446,432,409,338,319,267
167,17年春新做旧破洞乞丐牛仔裤女九分韩国高腰显瘦毛边小脚铅笔裤价格：198,漫步美库,90,91,10,//shop36429499.taobao.com,253,384,384,264,248,262,499,415,377,426,484,465,423,493
168,2017韩国高腰弹力牛仔裤女夏破洞修身毛边铅笔裤小脚九分裤浅蓝色价格：298,h荷,90,90,22,//weibo99.taobao.com,471,356,356,321,292,296,269,437,408,486,269,367,423,497
169,韩版烟灰色九分牛仔裤女显瘦黑色小脚裤高腰学生紧身弹力铅笔长裤价格：198,韩潮牛仔形象店,88,89,21,//shop150507029.taobao.com,,405,405,398,360,316,481,354,462,269,463,487,361,279
170,收腹牛仔短裤女夏高腰卷边显瘦排扣弹力新款牛仔裤浅色夏天性感潮价格：88,澜克利莎旗舰店,87,87,31,//lankelisha.tmall.com,228,229,229,439,471,434,463,466,486,364,397,342,430,331
171,牛仔裤女春夏季2017新款潮韩版高腰长裤黑色显瘦九分小脚裤铅笔裤价格：149,亦唯旗舰店,87,92,19,//yiweinz.tmall.com,,,,,,466,415,396,362,376,480,418,258,171
172,黑色高腰牛仔裤女九分裤春夏秋季2017新款韩版学生小脚铅笔长裤子价格：98,爱斯麦乐驹专卖店,86,87,17,//aisimylj.tmall.com,,,,,,,,,484,437,412,239,190,172
173,春夏薄款九分牛仔裤女 韩版高腰白色9分裤子 修身弹力小脚铅笔裤价格：118,百搭柚子小清新美衣YY,86,87,20,//shop100638665.taobao.com,475,442,442,239,227,245,426,271,270,496,385,497,442,285
174,秋装新款韩版修身显瘦毛边高腰牛仔裤女百搭弹力小脚铅笔裤长裤潮价格：39,港妹潮人馆,86,86,17,//bazhaoyi.taobao.com,286,453,453,329,465,302,362,306,300,324,262,305,333,287
175,破洞牛仔裤女春夏季2017新款韩版修身学生百搭高腰九分裤小脚长裤价格：37,小宅女大购物 xiaozhainv 小宅女家 xiao zhai nv,85,94,20,//zhainvjia.taobao.com,441,358,358,438,435,410,413,344,395,282,343,427,358,292
176,高腰牛仔裤女开叉九分裤2017秋季新款韩版显瘦蓝色百搭直筒铅笔裤价格：89,张小某,85,86,58,//shop323115517.taobao.com,,,,,,,,,,,,,,288
177,2017夏季薄款牛仔裤女九分裤修身显瘦弹力浅色破洞裤韩版小脚裤子价格：118,金善惠旗舰店,85,86,14,//jinshanhui.tmall.com,463,324,324,428,356,271,243,280,364,278,332,262,225,289
178,ONLY2017夏新男友风宽松做旧九分牛仔裤女|117149553价格：399,ONLY官方旗舰店,85,85,21,//only.tmall.com,107,,,241,428,315,54,95,52,40,,,,290
179,高腰牛仔裤女夏2017新款韩版秋季大码显瘦紧身个性开叉小脚九分裤价格：118,日韩女装潮依阁,85,85,50,//shop107327651.taobao.com,,,,,,,,,,,,,247,295
180,女士秋季新款裤子女潮显瘦秋装女2017韩版修身春夏季百搭牛仔长裤价格：79,音棉旗舰店,85,85,17,//yinmian.tmall.com,308,400,400,369,378,412,361,241,323,464,195,231,258,215
181,春夏季烟灰色牛仔裤女显瘦长裤子韩版弹力修身小脚裤潮高腰铅笔裤价格：109,莎伶旗舰店,85,86,16,//shalingnz.tmall.com,347,354,354,390,378,399,418,361,244,207,435,244,395,216
182,七分牛仔裤女夏季2017新款高腰韩版短裤百搭显瘦学生薄款7分裤子价格：198,fxdis旗舰店,84,84,40,//fxdis.tmall.com,,,,,,,164,414,222,167,97,87,95,218
183,高腰九分裤女2017春夏季新款学生韩版bf风宽松哈伦直筒牛仔裤子秋价格：298,爵巧旗舰店,84,84,68,//jueqiao.tmall.com,,,,,,,,,,,,,323,301
184,【8.8秋季新品 包邮+95折】黑色破洞牛仔裤女长裤高腰显瘦小脚裤价格：98,孙小念sue STUDIO,84,84,15,//sue822.taobao.com,,,,,,,,,,,,,,184
185,夏季薄款复古高腰膝盖破洞牛仔裤女九分裤紧身显瘦弹力小脚铅笔裤价格：108,赫度旗舰店,83,83,16,//hedunz.tmall.com,240,466,466,365,319,499,417,406,,458,438,370,324,304
186,牛仔短裤女夏2017新款高腰显瘦超短裤韩版学生百搭宽松胖mm热裤潮价格：189,韩风快时女装,83,83,35,//164495170.taobao.com,138,94,94,212,173,239,213,244,317,496,410,493,456,350
187,破洞牛仔裤女春夏季2017新款韩版显瘦九分裤瘦腿裤女外穿铅笔裤潮价格：98,爱惹美官方店,83,83,26,//shop112822766.taobao.com,277,263,263,447,336,192,377,267,413,378,233,473,262,310
188,打底裤女春夏季2017新款高腰排扣韩版显瘦学生薄款小脚裤外穿长裤价格：198,猫蔻旗舰店,82,82,28,//maokou.tmall.com,,,,,,,,,,,,,,312
189,MISS FLY 2017夏季新款女韩版重工钉珠开叉牛仔喇叭裤修身九分裤价格：178,MISS FLY飞姐定制,82,82,12,//fly-style.taobao.com,342,385,385,428,407,421,431,402,256,268,298,484,304,316
190,2017春夏新款破洞牛仔裤女韩版高腰显瘦九分裤女小脚裤女黑色裤子价格：168,attainluxury奢臻旗舰店,82,82,19,//shezhen.tmall.com,374,367,367,399,347,298,356,473,448,236,377,294,291,313
191,Vero Moda2017春季新品修身小脚划破九分牛仔裤|317149507价格：449,veromoda官方旗舰店,82,82,18,//veromoda.tmall.com,333,124,124,,,,409,470,98,218,,,,314
192,韩版新款牛仔短裤女夏季弹力显瘦2017薄款学生破洞短裤修身热裤潮价格：85,《韩美》,82,82,33,//shop112753329.taobao.com,220,228,228,211,222,188,249,269,222,261,328,292,374,367
193,欧洲站2017新款个性弹力破洞牛仔裤女九分裤修身小脚裤女士破洞裤价格：59.9,依园美高端定制,81,81,16,//shop556302403.taobao.com,427,312,312,452,376,358,304,330,215,305,217,292,480,326
194,2017新款夏季薄款韩国高腰牛仔裤女九分裤修身显瘦弹力小脚铅笔裤价格：128,灿莉娅旗舰店,81,81,13,//canliya.tmall.com,253,236,236,227,407,456,411,456,213,259,243,278,241,324
195,牛仔九分裤女高弹显瘦显高修身铅笔裤小脚破洞夏季韩版潮百搭裤子价格：120,揭阳泽宏贸易有限公司,81,81,17,//shop187860957.taobao.com,,,,,,,,68,170,382,,,438,325
196,夏季韩版百搭复古chic破洞牛仔裤修身显瘦弹力撕边小脚裤铅笔裤女价格：40,枯米枯米kumi,80,80,17,//kukumi.taobao.com,254,276,276,473,404,233,403,293,355,383,415,322,382,330
197,OSA欧莎2017秋装新款女装白色破洞修身牛仔裤显瘦直筒裤女C53012价格：229,osa品牌服饰旗舰店,80,80,31,//osa.tmall.com,,,,,,,294,,,,,,,240
198,2017黑色新款破洞牛仔裤女春季韩版九分裤学生铅笔裤女高腰小脚裤价格：98,十翼旗舰店,80,80,23,//tenflank.tmall.com,185,219,219,362,425,475,414,493,473,329,436,474,342,331
199,牛仔裤女九分裤春夏季2017新款高腰显瘦不规则毛边膝盖破洞小脚裤价格：168,WH 韩版原创定制,80,81,15,//shop117245319.taobao.com,240,460,460,498,268,334,381,326,480,430,198,227,337,332
200,破洞牛仔裤女春夏季2017新款时尚九分裤韩版薄款显瘦高腰百搭小脚价格：128,锦衣玉行工厂直销店,79,79,18,//shop100062567.taobao.com,495,402,402,285,335,313,364,217,261,252,381,362,394,341
201,烟灰色高腰牛仔裤女夏长裤紧身小脚裤2017秋装新款女韩版黑色裤子价格：149,欧选昕罗专卖店,79,80,22,//ouxuanxl.tmall.com,299,373,373,425,366,370,422,355,280,260,173,179,146,201
202,束脚哈伦裤牛仔长裤女春夏季2017新款宽松韩版高腰学生松紧腰秋装价格：99,梦希曼旗舰店,79,79,17,//mengximan.tmall.com,372,279,279,324,314,384,385,206,464,340,339,205,365,242
203,momo高腰弹力牛仔裤小脚裤九分裤毛边修身显瘦四季百搭韩版女装潮价格：79,佰丽坊时尚馆,79,79,11,//bestfun123.taobao.com,362,307,307,466,447,400,300,275,407,355,249,335,500,340
204,2017秋装新款修身显瘦黑色磨破洞牛仔裤韩版百搭铅笔长裤女学生潮价格：31.8,转角1号精品女装店,78,78,15,//zhuanjiaoyihao.taobao.com,124,143,143,141,150,146,118,135,156,190,153,134,173,204
205,【今天特价】2017韩国新款高腰紧身牛仔裤女春夏显瘦铅笔裤高弹性价格：298,h荷,78,78,24,//weibo99.taobao.com,338,371,371,320,261,344,451,286,338,286,334,360,465,346
206,2017新款牛仔裤七分裤女夏春季破洞薄款小脚韩版7分牛仔马裤中裤价格：109,百度衣裳,77,78,22,//shop141337092.taobao.com,428,469,469,429,467,444,132,495,151,188,484,476,139,206
207,牛仔裤女九分显瘦韩版秋季紧身小脚铅笔女裤春夏季2017新款长裤潮价格：79,絮述旗舰店,75,75,12,//xushu.tmall.com,323,344,344,290,482,294,306,297,309,358,303,370,311,356
208,新款高腰黑色显瘦卷边牛仔裤女韩版春夏季百搭女士九分铅笔小脚裤价格：110,幸运潮流店,75,77,27,//shop129493928.taobao.com,,,,,,,,,,,,468,386,210
209,爱&amp;middot;弗艾高腰牛仔短裤女夏卷边弹力胖MM阔腿短裤热裤学生修身显瘦价格：128,爱弗艾旗舰店,74,74,29,//aifuai.tmall.com,283,238,238,284,354,405,457,353,379,457,257,429,349,408
210,chic新款韩版学生高腰牛仔裤女九分裤百搭显瘦弹力修身小脚铅笔裤价格：108,君芯潮流服饰店,74,74,15,//shop141450546.taobao.com,,,,375,443,449,382,323,359,306,366,410,378,367
211,春夏新款高腰牛仔裤女九分裤2017显瘦韩版小脚学生高弹力铅笔裤子价格：198,绒懿旗舰店,74,75,23,//rongyinvzhuang.tmall.com,473,357,357,257,368,321,375,313,294,291,496,452,462,363
212,薄款牛仔裤女高腰七分裤弹力小脚裤大码松紧腰铅笔裤休闲哈伦中裤价格：198,欧晓女裤官方店,74,75,27,//cocopark2018.taobao.com,314,484,484,494,441,459,473,133,137,136,178,474,500,212
213,弹力牛仔裤女九分裤夏修身黑色小脚韩版高腰铅笔裤女201新款长裤价格：258,尚琛旗舰店,73,76,29,//shangchenfs.tmall.com,,,,,,358,499,405,425,286,357,275,385,370
214,牛仔裤女夏秋季2017新款韩版学生高腰显瘦九分裤修身小脚铅笔裤女价格：188,珂索菲旗舰店,73,73,21,//kesuofei.tmall.com,,,,464,282,,,,,,,,450,371
215,2017韩版弹力修身显瘦牛仔裤女高腰小脚裤学生铅笔裤紧身长裤黑色价格：33.8,月牙城,73,74,19,//yueyacheng.taobao.com,277,290,290,327,332,203,224,196,170,255,277,196,310,215
216,黑色牛仔裤女夏九分裤长裤小脚裤显瘦紧身韩版2017秋季新款铅笔裤价格：109,乐誉服饰专营店,72,72,21,//leyufs.tmall.com,275,419,419,462,426,401,475,395,449,327,289,334,450,376
217,破洞牛仔裤女弹力九分小脚裤2017夏季新款韩版高腰修身显瘦裤子潮价格：126,东门女装衣柜,72,72,20,//shop125537505.taobao.com,,,,,,,,,,,,301,284,377
218,韩版春夏季新款牛仔裤女长裤高腰九分小脚弹力黑色显瘦学生铅笔裤价格：198,依站到底旗舰店,72,73,31,//yizhandaodi.tmall.com,229,287,287,371,261,217,238,313,222,229,255,255,232,218
219,七分牛仔裤女春夏季2017新款7分学生弹力修身破洞小脚中马裤薄款价格：98,荷q旗舰店,72,72,25,//hetinz.tmall.com,372,390,390,224,195,291,301,264,251,337,264,331,348,267
220,2017秋季新款裤子 韩版破洞牛仔裤女修身弹力铅笔裤长裤小脚裤潮价格：109,果果家  GG WOMEN女装潮店周一上新,72,73,18,//i-guoguo.taobao.com,,,,,,,,,,,,,245,220
221,高腰牛仔裤女春夏季2017新款九分小脚裤长裤韩版修身显瘦铅笔裤子价格：89,多美猫旗舰店,71,72,73,//duomeimao.tmall.com,,,,,,,,,,,485,400,253,221
222,商场同款诗凡黎2017秋装新款裤子小脚裤百搭破洞烂牛仔裤女九分裤价格：598,诗凡黎官方旗舰店,71,71,27,//seifini.tmall.com,,,,,,,,,,,,,,386
223,夏季女装九分牛仔裤女修身小脚裤女士弹力高腰显瘦长裤女学生裤潮价格：69,忆馨文艺女装店,71,72,20,//shop103344414.taobao.com,201,285,285,274,228,206,262,267,413,460,335,342,317,391
224,黑色牛仔裤女九分裤春夏季2017新款韩版裤子显瘦秋装小脚裤铅笔裤价格：159,卡仑奴旗舰店,71,75,17,//kalunnu.tmall.com,,,,,,,,,,,375,409,382,273
225,韩版春夏新款牛仔裤女显瘦修身弹力铅笔裤中腰紧身小脚九分裤2017价格：29,便宜有好货牛仔,70,71,22,//shop113879854.taobao.com,,,,,,,,,,482,,493,361,398
226,牛仔裤女高弹力破洞新款高腰显瘦韩版百搭九分铅笔小脚长裤毛边价格：198,韦纳尔旗舰店,70,70,31,//viounar.tmall.com,,,,,,,,,,,,,,226
227,长裤牛仔裤2017春夏季新款九分裤女韩版秋装女百搭显瘦修身女裤子价格：79,音棉旗舰店,69,70,17,//yinmian.tmall.com,311,361,361,332,312,309,212,263,358,266,261,349,201,285
228,牛仔裤女士长裤 秋装2017新款弹力修身显瘦韩版学生小脚铅笔裤夏价格：228,公A殿下旗舰店,69,69,22,//gongzhudianxia.tmall.com,296,339,339,272,174,253,222,190,219,388,218,210,210,278
229,2017春秋款破洞牛仔裤女九分裤弹力紧身小脚裤韩版学生显瘦铅笔裤价格：108,粤潮旗舰店,69,69,19,//yuechao.tmall.com,371,375,375,429,489,357,398,481,445,363,473,419,409,400
230,牛仔裤女黑色长裤高腰显瘦秋季2017秋装新款女学生韩版小脚裤子潮价格：79,萌路旗舰店,69,69,19,//menglufs.tmall.com,194,205,205,205,238,175,177,474,155,461,130,189,141,230
231,天天特价欧洲站紧身破洞牛仔裤女刺绣潮流补丁铅笔裤显瘦小脚长裤价格：180,小马奔腾品质牛仔,69,69,18,//shop115893988.taobao.com,,,,,,,,,410,164,195,169,202,231
232,尚驭牛仔短裤女夏中腰宽松大码破洞学生显瘦卷边直筒牛仔裤女热裤价格：158,尚驭服饰旗舰店,69,69,19,//whshangyu.tmall.com,320,331,331,309,360,371,344,451,376,471,364,450,461,435
233,破洞牛仔裤女九分裤2017夏季新款高腰显瘦紧身弹力毛边小脚铅笔裤价格：138,蒙奴莎官方店,68,68,15,//mengnusha.taobao.com,198,425,425,293,468,256,277,340,480,400,353,278,412,405
234,显瘦牛仔裤女九分裤小脚裤2017春夏季新款铅笔裤长裤刺绣女裤子秋价格：129,艾妃尼思服饰旗舰店,68,68,20,//aifeinisi.tmall.com,,,,,,,,,,450,367,346,459,288
235,秋季新款黑色高腰膝盖破洞牛仔裤女九分裤紧身显瘦毛边9分小脚裤价格：128,BANANA原创牛仔设计,68,68,22,//shop127330067.taobao.com,,,,,,,,,338,295,298,392,323,410
236,七分牛仔裤女夏季薄款弹力显瘦小脚大码破洞马裤五分中裤学生短裤价格：99,娜馨旗舰店,67,67,21,//naxinfs.tmall.com,234,227,227,159,191,156,229,202,166,196,178,222,199,296
237,牛仔裤高腰2017新款春夏季九分显瘦学生韩版铅笔女士弹力小脚长裤价格：100,雅羊人旗舰店,67,68,26,//yayangren.tmall.com,,,,,,,,,489,443,389,306,329,299
238,黑色膝盖大破洞显瘦修身弹力高腰小脚铅笔九分牛仔裤女9分乞丐夏价格：69,92淘吧,67,69,20,//92taoba.taobao.com,329,500,500,292,442,340,334,484,329,316,337,384,414,423
239,2017秋夏季新款黑色膝盖破洞九分牛仔裤女韩版修身显瘦小脚长裤子价格：109,韩国范 沫儿时尚女装,66,68,19,//shop114189449.taobao.com,,,,364,354,328,245,247,299,202,161,133,138,239
240,高腰牛仔裤女2017春夏季秋季新款韩版女裤薄款长裤显瘦小脚铅笔裤价格：178,rky旗舰店,66,66,21,//rkynz.tmall.com,150,181,181,382,163,234,151,231,188,225,172,197,208,240
241,高腰牛仔裤女九分裤夏季薄款2017新款显瘦小脚长裤胖mm大码铅笔裤价格：168,尚大优品,66,66,21,//shop314615714.taobao.com,318,491,491,386,315,371,218,222,221,378,273,333,413,256
242,高腰弹力九分牛仔裤女秋夏季新款韩版学生修身显瘦小脚铅笔长裤子价格：74,第四十九天 49t,65,65,20,//shop136501012.taobao.com,,,,,,,457,380,439,354,369,490,309,431
243,牛仔七分裤女夏2017新款 薄款高腰松紧腰显瘦大码胖mm中裤五分裤价格：139,琳宛旗舰店,65,65,18,//linwan.tmall.com,295,222,222,189,483,188,207,496,487,177,304,214,194,257
244,2017夏季新款白色破洞牛仔女修身显瘦弹力紧身休闲大码外穿短裤子价格：89,妙曼伊菲儿,65,66,21,//shop128354197.taobao.com,225,207,207,209,212,201,171,182,249,357,335,340,420,464
245,尚驭牛仔裤女铅笔裤2017秋季新款弹力修身显瘦破洞紧身小脚裤长裤价格：328,尚驭服饰旗舰店,65,65,15,//whshangyu.tmall.com,350,346,346,244,229,226,216,207,241,288,243,346,259,306
246,高腰流苏牛仔裤女九分裤秋装春夏季2017新款韩版百搭显瘦小脚长裤价格：118,心计划旗舰店,65,65,13,//xinjihua.tmall.com,358,304,304,441,327,309,280,429,286,438,392,291,380,436
247,买一送一高腰牛仔短裤女2017新款春季韩版显瘦百搭学生超短裤女夏价格：79,皇朝御纺旗舰店,64,64,31,//huangchaoyufang.tmall.com,105,168,168,69,79,89,62,78,69,86,106,324,411,469
248,买一送一  秋季新品高腰弹力小脚裤价格：99,斯酷服饰,64,64,19,//shop144773796.taobao.com,,,,,,,,,,,,,,248
249,韩版女装包脚拉毛破洞水洗牛仔裤女修身显瘦紧身铅笔裤九分裤子潮价格：29.9,月牙城,64,64,16,//yueyacheng.taobao.com,445,376,376,344,450,451,391,314,465,320,313,372,343,444
250,牛仔裤女七分裤夏季韩版显瘦7分裤薄款中裤大码热裤2017新款女裤价格：198,娇宣尼旗舰店,63,63,21,//jiaoxuanni.tmall.com,245,236,236,464,433,359,441,394,378,409,410,285,233,317
251,俞兆林高腰牛仔七分裤女夏新款小脚铅笔裤薄7分牛仔裤女中裤潮价格：118,曼岛服饰专营店,63,64,38,//mandaofs.tmall.com,464,454,454,383,373,320,243,424,422,112,406,431,427,264
252,2017新款松紧腰牛仔短裤女夏韩版高腰薄款毛边热裤修身显瘦翻边裤价格：258,艾酷佳人女装品牌店,63,66,40,//ak788.taobao.com,206,235,235,225,184,199,333,291,320,473,365,484,276,476
253,2017韩版新款高腰修身显瘦弹力小脚裤九分裤毛边铅笔女秋季牛仔裤价格：298,h荷,63,64,21,//weibo99.taobao.com,,,,,,,,339,,,425,266,470,451
254,ONLY夏新磨破毛边小脚九分牛仔裤女|117249517价格：549,ONLY官方旗舰店,63,63,15,//only.tmall.com,171,65,65,404,376,378,109,40,74,402,57,72,115,449
255,2017春季新款烟灰色百搭破洞牛仔裤女韩版小脚高腰九分裤学生潮秋价格：118,匹克玛旗舰店,63,63,15,//pikema.tmall.com,496,311,311,266,370,481,443,256,469,466,364,411,354,454
256,2017明星同款高腰黑色紧身牛仔裤女九分毛边开叉小脚裤显瘦韩版潮价格：89,依沐蓝旗舰店,62,62,21,//yimulan.tmall.com,,,,,,,,,,481,448,438,425,458
257,高腰烟灰色牛仔裤女夏小脚修身铅笔潮流薄款bf风紧身黑色九分裤子价格：128,晶彩日韩女装,62,62,80,//shop224859407.taobao.com,,,,,,,,,,,305,399,396,459
258,大码高腰薄款牛仔裤女夏宽松九分裤弹力显瘦女士胖mm潮长裤200斤价格：99,GO酷时尚牛仔坊,62,62,27,//gocoolsh.taobao.com,341,321,321,461,242,315,261,309,283,364,294,445,367,460
