131,2017秋季弹力高腰牛仔裤女深色紧身小脚裤长裤大码修身女裤春秋潮价格：138,澜克利莎旗舰店,104,105,23,//lankelisha.tmall.com,64,63,63,87,63,94,87,98,104,78,73,100,105,104
132,黑色高腰显瘦女士牛仔裤女夏2017新款韩版百搭铅笔小脚裤九分裤子价格：138,开阔服饰旗舰店,103,103,18,//kaikuo.tmall.com,25,27,27,48,51,48,42,44,,41,40,51,80,103
133,牛仔裤女高腰九分小脚裤弹力显瘦2017新款百搭学生铅笔长裤子大码价格：268,媚倍儿旗舰店,103,103,20,//meibeier.tmall.com,,,,28,,,39,60,87,91,72,86,111,103
134,自制夏季个性牛仔裤2017韩国百搭阔腿裤女高腰基础休闲裤翻边长裤价格：79.9,馨帮帮sinbounboun,103,104,12,//sinbounboun.taobao.com,,,,,,,,,,,,,,103
135,2017秋冬季弹力中腰九分牛仔裤女深色紧身小脚裤长裤大码修身最新价格：68,苏安丽t旗店,103,103,76,//shop115692071.taobao.com,39,52,52,,,,,,,,23,33,56,103
136,高腰牛仔裤女2017秋新款弹力显瘦九分裤烟灰色小脚铅笔长裤韩版潮价格：39.9,liujunzhanlan,102,103,29,//baiyulan.taobao.com,,,,,,,,,37,26,36,49,77,102
137,韩版高腰牛仔裤女小脚长裤2017新款学生九分裤弹力修身显瘦铅笔裤价格：198,北艾旗舰店,102,118,42,//beiainz.tmall.com,,,,,,,,,,,,,40,102
138,春夏季新款牛仔裤女女式高腰小脚韩版显瘦中学生松紧腰带加长裤子价格：98,好酷风好牛仔,102,104,15,//yyc8888.taobao.com,59,59,59,107,99,79,103,86,85,78,113,98,92,102
139,春季韩国显瘦紧身烟灰色膝盖破洞牛仔裤女铅笔裤做旧小脚裤九分裤价格：138,艾恺铭原创,101,101,16,//zhouxiaoqi168.taobao.com,46,41,41,75,51,49,84,70,65,61,84,70,70,101
140,复古港味修身显瘦膝盖破洞牛仔裤女九分裤弹力百搭小脚裤铅笔裤子价格：39,港妹潮人馆,101,101,17,//bazhaoyi.taobao.com,97,80,80,89,98,82,104,98,98,95,66,94,87,101
141,海熙2017夏款薄款磨破高腰牛仔短裤女韩版破洞阔腿宽松显瘦热裤潮价格：155,海熙旗舰店,100,100,15,//haixi.tmall.com,,2871,2871,1343,440,160,14,,,1597,861,943,223,100
142,拉贝缇2017夏装新款高腰简约休闲牛仔裤丹宁小脚裤女九分裤价格：199,lababite官方旗舰店,100,103,14,//lababite.tmall.com,141,62,62,,,,,154,,,,,210,100
143,森马直筒牛仔裤女 2017夏季新款 学生弹力韩版时尚修身小脚八分裤价格：199,森马官方旗舰店,100,103,21,//semir.tmall.com,26,,,106,82,31,,,,,,,,100
144,【8.8新品  9折+包邮】丢丢韩版黑色脚口毛边小脚裤价格：135,DIUDIU ROOM 丢丢定制,99,99,24,//honey-diudiu.taobao.com,,,,,,,,,,,,,,99
145,牛仔裤女春夏季修身显瘦韩版紧身弹力高腰收腹学生铅笔百搭长裤子价格：98,揭阳泽宏贸易有限公司,99,99,14,//shop187860957.taobao.com,,,,,,,,,,,,,,99
146,牛仔短裤女夏季2017新款韩版百搭弹力磨破洞显瘦学生毛边热裤子潮价格：168,怜雪服饰旗舰店,97,97,26,//lianxuefs.tmall.com,127,110,110,98,114,89,102,96,93,97,126,93,109,97
147,菲己2017秋黑色修身开叉九分裤学生韩版显瘦流苏牛仔裤女紧身小脚价格：189,菲己旗舰店,97,97,34,//feijitz.tmall.com,,,,,,,,,,,,,,97
148,2017新款夏季女士牛仔短裤韩版少女宽松白色热裤破洞百搭松紧外穿价格：168,婕恋旗舰店,97,97,20,//jielian.tmall.com,1104,2721,2721,138,172,159,136,96,111,100,69,101,117,97
149,2017新款破洞牛仔裤女夏季韩版小脚显瘦百搭九分裤黑色学生长裤子价格：168,靡格旗舰店,97,97,20,//migenz.tmall.com,35,44,44,,26,25,27,,,,28,69,59,97
150,弹力修身高腰牛仔裤女大码胖mm小脚长裤秋季黑色铅笔裤春秋薄款潮价格：96,澜克利莎旗舰店,97,97,23,//lankelisha.tmall.com,79,73,73,96,102,63,112,94,74,84,75,97,101,97
151,渔网破洞烂牛仔裤女夏九分裤秋季韩版显瘦小脚裤子2017秋装新款潮价格：99,恋人心服饰旗舰店,96,96,18,//lianrenxinfs.tmall.com,101,96,96,110,106,101,95,104,96,93,102,86,76,96
152,Alice&amp;amp;W  破洞牛仔裤女长裤春夏季2017新款修身小脚裤铅笔裤价格：232,Alice wang潮流女装,95,97,16,//huahua868.taobao.com,60,55,55,65,82,66,57,75,48,68,54,47,38,95
153,2017夏秋新款九分牛仔裤女高腰黑色紧身显瘦小脚裤简约修身长裤子价格：49.9,胶己人的女装店,94,94,17,//shop113363827.taobao.com,,,,,,39,73,69,,70,51,72,97,94
154,谜团秋装牛仔裤女夏2017新款九分裤韩版薄款显瘦紧身小脚铅笔裤潮价格：199,谜团旗舰店,94,94,12,//mituan.tmall.com,141,139,139,111,103,105,132,143,155,146,135,144,149,94
155,3712 秋季新款韩版网格毛边破洞牛仔裤女高弹力开衩修身小脚裤潮价格：22.99,第六神话华玉美衣女装成衣性价比之王外贸批发零售,93,104,25,//thesixthmyths.taobao.com,,,,,,,,,,,,,,93
156,春夏季韩版高腰烂牛仔裤女破洞宽松显瘦九分裤女装乞丐小脚裤子潮价格：158,冬月L兮,92,92,20,//shop108206730.taobao.com,150,124,124,84,170,174,162,159,184,151,109,110,66,92
157,2017新款高腰牛仔裤女长裤收腹修身显瘦弹力松紧腰大码排扣小脚裤价格：128,媛范旗舰店,92,92,19,//yuanfannz.tmall.com,29,30,30,32,53,47,44,56,72,42,63,77,79,92
158,天天特价春季高腰牛仔裤女九分裤显瘦紧身蓝色弹力修身小脚铅笔裤价格：199,衣艺社日韩女装,92,92,14,//yiyisherihan.taobao.com,81,55,55,56,73,60,70,68,66,52,66,80,78,92
159,黑色高腰修身九分裤流苏毛边紧身铅笔小脚牛仔裤女夏2017新款长裤价格：118,smbath旗舰店,92,92,13,//smbath.tmall.com,,,,,,,,,,29,30,42,55,92
160,夏装女装新款韩版百搭修身牛仔裤高腰显瘦铅笔裤九分裤长裤小脚裤价格：39.98,可可里小姐,92,92,14,//misskkl.taobao.com,67,68,68,70,61,72,81,82,102,76,73,96,83,92
161,2017新款七分牛仔裤女小脚修身弹力高腰薄款中裤翻边百搭马裤女夏价格：299,柔伊美旗舰店,91,92,26,//rouyimei.tmall.com,246,192,192,86,104,71,71,72,62,91,90,108,100,91
162,黑色膝盖破洞牛仔裤女九分裤夏薄款韩版高腰显瘦不规则紧身小脚裤价格：128,GAG红人馆,91,92,21,//shop107223039.taobao.com,108,87,87,123,113,125,101,125,113,87,83,83,77,91
163,◆MUGU蘑菇◆破洞黑色牛仔裤女夏九分小脚弹力百搭高腰修身显瘦价格：142,MUGU STUDIO 蘑菇定制,91,91,11,//mugu520.taobao.com,,,,,,,,,,,,,53,91
164,森马牛仔裤女2017秋季新款韩版显瘦九分裤修身小脚裤bf风学生裤子价格：199,森马官方旗舰店,91,91,27,//semir.tmall.com,,,,49,42,,,,,,,,,91
165,CBC2017新款超高弹力夏季牛仔短裤女深蓝色卷边韩版修身显瘦热裤价格：218,cobcbc服饰旗舰店,91,91,21,//cobcbc.tmall.com,113,78,78,81,58,89,79,89,74,58,72,98,98,91
166,高腰黑色膝盖破洞牛仔裤女夏烂毛边韩版显瘦紧身小脚铅笔九分裤潮价格：299,Jeans 女装,90,90,18,//shop121404425.taobao.com,,,,,,,30,51,51,51,54,67,74,90
167,17年春新做旧破洞乞丐牛仔裤女九分韩国高腰显瘦毛边小脚铅笔裤价格：198,漫步美库,90,91,10,//shop36429499.taobao.com,68,52,52,74,79,71,81,108,117,101,93,87,104,90
168,2017韩国高腰弹力牛仔裤女夏破洞修身毛边铅笔裤小脚九分裤浅蓝色价格：298,h荷,90,90,22,//weibo99.taobao.com,49,55,55,62,70,65,72,51,55,47,73,63,60,90
169,韩版烟灰色九分牛仔裤女显瘦黑色小脚裤高腰学生紧身弹力铅笔长裤价格：198,韩潮牛仔形象店,88,89,21,//shop150507029.taobao.com,,29,29,53,59,62,48,61,50,73,82,85,68,88
170,收腹牛仔短裤女夏高腰卷边显瘦排扣弹力新款牛仔裤浅色夏天性感潮价格：88,澜克利莎旗舰店,87,87,31,//lankelisha.tmall.com,104,85,85,79,80,105,99,97,69,115,80,98,72,87
171,牛仔裤女春夏季2017新款潮韩版高腰长裤黑色显瘦九分小脚裤铅笔裤价格：149,亦唯旗舰店,87,92,19,//yiweinz.tmall.com,,,,,,19,22,23,38,34,28,24,50,87
172,黑色高腰牛仔裤女九分裤春夏秋季2017新款韩版学生小脚铅笔长裤子价格：98,爱斯麦乐驹专卖店,86,87,17,//aisimylj.tmall.com,,,,,,,,,27,29,31,50,65,86
173,春夏薄款九分牛仔裤女 韩版高腰白色9分裤子 修身弹力小脚铅笔裤价格：118,百搭柚子小清新美衣YY,86,87,20,//shop100638665.taobao.com,55,47,47,81,83,74,92,76,75,77,57,83,89,86
174,秋装新款韩版修身显瘦毛边高腰牛仔裤女百搭弹力小脚铅笔裤长裤潮价格：39,港妹潮人馆,86,86,17,//bazhaoyi.taobao.com,38,27,27,37,48,38,59,69,68,64,74,72,73,86
175,破洞牛仔裤女春夏季2017新款韩版修身学生百搭高腰九分裤小脚长裤价格：37,小宅女大购物 xiaozhainv 小宅女家 xiao zhai nv,85,94,20,//zhainvjia.taobao.com,44,55,55,49,50,51,54,63,56,71,61,56,68,85
176,高腰牛仔裤女开叉九分裤2017秋季新款韩版显瘦蓝色百搭直筒铅笔裤价格：89,张小某,85,86,58,//shop323115517.taobao.com,,,,,,,,,,,,,,85
177,2017夏季薄款牛仔裤女九分裤修身显瘦弹力浅色破洞裤韩版小脚裤子价格：118,金善惠旗舰店,85,86,14,//jinshanhui.tmall.com,44,35,35,49,59,69,76,73,60,71,62,81,93,85
178,ONLY2017夏新男友风宽松做旧九分牛仔裤女|117149553价格：399,ONLY官方旗舰店,85,85,21,//only.tmall.com,13,,,80,29,36,22,14,23,27,,,,85
179,高腰牛仔裤女夏2017新款韩版秋季大码显瘦紧身个性开叉小脚九分裤价格：118,日韩女装潮依阁,85,85,50,//shop107327651.taobao.com,,,,,,,,,,,,,51,85
180,女士秋季新款裤子女潮显瘦秋装女2017韩版修身春夏季百搭牛仔长裤价格：79,音棉旗舰店,85,85,17,//yinmian.tmall.com,39,22,22,51,46,42,47,65,53,39,73,70,63,85
181,春夏季烟灰色牛仔裤女显瘦长裤子韩版弹力修身小脚裤潮高腰铅笔裤价格：109,莎伶旗舰店,85,86,16,//shalingnz.tmall.com,58,61,61,49,33,43,41,46,66,72,86,67,98,85
182,七分牛仔裤女夏季2017新款高腰韩版短裤百搭显瘦学生薄款7分裤子价格：198,fxdis旗舰店,84,84,40,//fxdis.tmall.com,,,,,,,21,42,74,92,125,143,134,84
183,高腰九分裤女2017春夏季新款学生韩版bf风宽松哈伦直筒牛仔裤子秋价格：298,爵巧旗舰店,84,84,68,//jueqiao.tmall.com,,,,,,,,,,,,,42,84
184,【8.8秋季新品 包邮+95折】黑色破洞牛仔裤女长裤高腰显瘦小脚裤价格：98,孙小念sue STUDIO,84,84,15,//sue822.taobao.com,,,,,,,,,,,,,,84
185,夏季薄款复古高腰膝盖破洞牛仔裤女九分裤紧身显瘦弹力小脚铅笔裤价格：108,赫度旗舰店,83,83,16,//hedunz.tmall.com,43,41,41,33,36,23,30,31,,28,51,48,73,83
186,牛仔短裤女夏2017新款高腰显瘦超短裤韩版学生百搭宽松胖mm热裤潮价格：189,韩风快时女装,83,83,35,//164495170.taobao.com,293,384,384,184,221,164,177,154,132,89,89,99,68,83
187,破洞牛仔裤女春夏季2017新款韩版显瘦九分裤瘦腿裤女外穿铅笔裤潮价格：98,爱惹美官方店,83,83,26,//shop112822766.taobao.com,84,74,74,102,127,90,116,150,108,113,81,102,84,83
188,打底裤女春夏季2017新款高腰排扣韩版显瘦学生薄款小脚裤外穿长裤价格：198,猫蔻旗舰店,82,82,28,//maokou.tmall.com,,,,,,,,,,,,,,82
189,MISS FLY 2017夏季新款女韩版重工钉珠开叉牛仔喇叭裤修身九分裤价格：178,MISS FLY飞姐定制,82,82,12,//fly-style.taobao.com,113,105,105,90,98,92,91,95,79,73,67,85,77,82
190,2017春夏新款破洞牛仔裤女韩版高腰显瘦九分裤女小脚裤女黑色裤子价格：168,attainluxury奢臻旗舰店,82,82,19,//shezhen.tmall.com,30,32,32,31,35,38,60,48,51,79,57,74,78,82
191,Vero Moda2017春季新品修身小脚划破九分牛仔裤|317149507价格：449,veromoda官方旗舰店,82,82,18,//veromoda.tmall.com,5,12,12,,,,54,27,16,7,,,,82
192,韩版新款牛仔短裤女夏季弹力显瘦2017薄款学生破洞短裤修身热裤潮价格：85,《韩美》,82,82,33,//shop112753329.taobao.com,206,178,178,152,149,163,123,113,133,114,95,114,82,82
193,欧洲站2017新款个性弹力破洞牛仔裤女九分裤修身小脚裤女士破洞裤价格：59.9,依园美高端定制,81,81,16,//shop556302403.taobao.com,26,36,36,48,57,56,67,65,90,67,84,75,96,81
194,2017新款夏季薄款韩国高腰牛仔裤女九分裤修身显瘦弹力小脚铅笔裤价格：128,灿莉娅旗舰店,81,81,13,//canliya.tmall.com,79,82,82,83,111,101,109,99,90,74,78,78,88,81
195,牛仔九分裤女高弹显瘦显高修身铅笔裤小脚破洞夏季韩版潮百搭裤子价格：120,揭阳泽宏贸易有限公司,81,81,17,//shop187860957.taobao.com,,,,,,,,401,202,33,,,102,81
196,夏季韩版百搭复古chic破洞牛仔裤修身显瘦弹力撕边小脚裤铅笔裤女价格：40,枯米枯米kumi,80,80,17,//kukumi.taobao.com,163,139,139,85,99,77,97,123,106,94,89,70,65,80
197,OSA欧莎2017秋装新款女装白色破洞修身牛仔裤显瘦直筒裤女C53012价格：229,osa品牌服饰旗舰店,80,80,31,//osa.tmall.com,,,,,,,55,,,,,,,80
198,2017黑色新款破洞牛仔裤女春季韩版九分裤学生铅笔裤女高腰小脚裤价格：98,十翼旗舰店,80,80,23,//tenflank.tmall.com,244,203,203,118,108,98,109,92,87,123,85,102,71,80
199,牛仔裤女九分裤春夏季2017新款高腰显瘦不规则毛边膝盖破洞小脚裤价格：168,WH 韩版原创定制,80,81,15,//shop117245319.taobao.com,120,109,109,91,153,127,115,132,97,101,89,89,72,80
200,破洞牛仔裤女春夏季2017新款时尚九分裤韩版薄款显瘦高腰百搭小脚价格：128,锦衣玉行工厂直销店,79,79,18,//shop100062567.taobao.com,23,29,29,69,127,131,119,168,149,76,57,64,63,79
201,烟灰色高腰牛仔裤女夏长裤紧身小脚裤2017秋装新款女韩版黑色裤子价格：149,欧选昕罗专卖店,79,80,22,//ouxuanxl.tmall.com,37,31,31,22,23,31,30,35,45,46,63,65,77,79
202,束脚哈伦裤牛仔长裤女春夏季2017新款宽松韩版高腰学生松紧腰秋装价格：99,梦希曼旗舰店,79,79,17,//mengximan.tmall.com,33,40,40,57,53,44,44,72,41,50,49,76,48,79
203,momo高腰弹力牛仔裤小脚裤九分裤毛边修身显瘦四季百搭韩版女装潮价格：79,佰丽坊时尚馆,79,79,11,//bestfun123.taobao.com,64,62,62,47,49,52,67,74,55,60,77,68,82,79
204,2017秋装新款修身显瘦黑色磨破洞牛仔裤韩版百搭铅笔长裤女学生潮价格：31.8,转角1号精品女装店,78,78,15,//zhuanjiaoyihao.taobao.com,74,71,71,76,70,66,81,78,74,58,69,82,70,78
205,【今天特价】2017韩国新款高腰紧身牛仔裤女春夏显瘦铅笔裤高弹性价格：298,h荷,78,78,24,//weibo99.taobao.com,80,53,53,62,76,57,51,72,62,70,62,64,55,78
206,2017新款牛仔裤七分裤女夏春季破洞薄款小脚韩版7分牛仔马裤中裤价格：109,百度衣裳,77,78,22,//shop141337092.taobao.com,117,91,91,90,89,104,76,92,223,188,79,86,80,77
207,牛仔裤女九分显瘦韩版秋季紧身小脚铅笔女裤春夏季2017新款长裤潮价格：79,絮述旗舰店,75,75,12,//xushu.tmall.com,69,63,63,68,86,66,67,70,66,60,66,63,76,75
208,新款高腰黑色显瘦卷边牛仔裤女韩版春夏季百搭女士九分铅笔小脚裤价格：110,幸运潮流店,75,77,27,//shop129493928.taobao.com,,,,,,,,,,,,28,45,75
209,爱&amp;middot;弗艾高腰牛仔短裤女夏卷边弹力胖MM阔腿短裤热裤学生修身显瘦价格：128,爱弗艾旗舰店,74,74,29,//aifuai.tmall.com,74,82,82,64,52,46,41,50,46,70,64,110,88,74
210,chic新款韩版学生高腰牛仔裤女九分裤百搭显瘦弹力修身小脚铅笔裤价格：108,君芯潮流服饰店,74,74,15,//shop141450546.taobao.com,,,,33,28,42,58,66,61,67,59,59,66,74
211,春夏新款高腰牛仔裤女九分裤2017显瘦韩版小脚学生高弹力铅笔裤子价格：198,绒懿旗舰店,74,75,23,//rongyinvzhuang.tmall.com,82,55,55,76,58,61,58,68,69,69,91,90,88,74
212,薄款牛仔裤女高腰七分裤弹力小脚裤大码松紧腰铅笔裤休闲哈伦中裤价格：198,欧晓女裤官方店,74,75,27,//cocopark2018.taobao.com,150,105,105,82,106,86,98,79,83,75,63,86,93,74
213,弹力牛仔裤女九分裤夏修身黑色小脚韩版高腰铅笔裤女201新款长裤价格：258,尚琛旗舰店,73,76,29,//shangchenfs.tmall.com,,,,,,32,47,54,54,43,60,44,65,73
214,牛仔裤女夏秋季2017新款韩版学生高腰显瘦九分裤修身小脚铅笔裤女价格：188,珂索菲旗舰店,73,73,21,//kesuofei.tmall.com,,,,47,40,,,,,,,,101,73
215,2017韩版弹力修身显瘦牛仔裤女高腰小脚裤学生铅笔裤紧身长裤黑色价格：33.8,月牙城,73,74,19,//yueyacheng.taobao.com,39,39,39,37,36,52,52,59,70,47,44,61,44,73
216,黑色牛仔裤女夏九分裤长裤小脚裤显瘦紧身韩版2017秋季新款铅笔裤价格：109,乐誉服饰专营店,72,72,21,//leyufs.tmall.com,39,51,51,47,95,96,84,96,90,105,69,117,88,72
217,破洞牛仔裤女弹力九分小脚裤2017夏季新款韩版高腰修身显瘦裤子潮价格：126,东门女装衣柜,72,72,20,//shop125537505.taobao.com,,,,,,,,,,,,40,46,72
218,韩版春夏季新款牛仔裤女长裤高腰九分小脚弹力黑色显瘦学生铅笔裤价格：198,依站到底旗舰店,72,73,31,//yizhandaodi.tmall.com,45,39,39,33,43,50,49,39,56,51,47,47,54,72
219,七分牛仔裤女春夏季2017新款7分学生弹力修身破洞小脚中马裤薄款价格：98,荷q旗舰店,72,72,25,//hetinz.tmall.com,56,55,55,76,86,61,60,66,66,51,63,54,50,72
220,2017秋季新款裤子 韩版破洞牛仔裤女修身弹力铅笔裤长裤小脚裤潮价格：109,果果家  GG WOMEN女装潮店周一上新,72,73,18,//i-guoguo.taobao.com,,,,,,,,,,,,,163,72
221,高腰牛仔裤女春夏季2017新款九分小脚裤长裤韩版修身显瘦铅笔裤子价格：89,多美猫旗舰店,71,72,73,//duomeimao.tmall.com,,,,,,,,,,,20,32,50,71
222,商场同款诗凡黎2017秋装新款裤子小脚裤百搭破洞烂牛仔裤女九分裤价格：598,诗凡黎官方旗舰店,71,71,27,//seifini.tmall.com,,,,,,,,,,,,,,71
223,夏季女装九分牛仔裤女修身小脚裤女士弹力高腰显瘦长裤女学生裤潮价格：69,忆馨文艺女装店,71,72,20,//shop103344414.taobao.com,97,69,69,71,83,86,73,77,43,38,62,67,75,71
224,黑色牛仔裤女九分裤春夏季2017新款韩版裤子显瘦秋装小脚裤铅笔裤价格：159,卡仑奴旗舰店,71,75,17,//kalunnu.tmall.com,,,,,,,,,,,25,32,47,71
225,韩版春夏新款牛仔裤女显瘦修身弹力铅笔裤中腰紧身小脚九分裤2017价格：29,便宜有好货牛仔,70,71,22,//shop113879854.taobao.com,,,,,,,,,,36,,37,49,70
226,牛仔裤女高弹力破洞新款高腰显瘦韩版百搭九分铅笔小脚长裤毛边价格：198,韦纳尔旗舰店,70,70,31,//viounar.tmall.com,,,,,,,,,,,,,,70
227,长裤牛仔裤2017春夏季新款九分裤女韩版秋装女百搭显瘦修身女裤子价格：79,音棉旗舰店,69,70,17,//yinmian.tmall.com,35,32,32,57,54,52,72,61,38,61,62,49,75,69
228,牛仔裤女士长裤 秋装2017新款弹力修身显瘦韩版学生小脚铅笔裤夏价格：228,公A殿下旗舰店,69,69,22,//gongzhudianxia.tmall.com,74,63,63,65,83,62,70,76,75,93,69,73,73,69
229,2017春秋款破洞牛仔裤女九分裤弹力紧身小脚裤韩版学生显瘦铅笔裤价格：108,粤潮旗舰店,69,69,19,//yuechao.tmall.com,30,31,31,29,45,32,43,26,30,26,37,31,44,69
230,牛仔裤女黑色长裤高腰显瘦秋季2017秋装新款女学生韩版小脚裤子潮价格：79,萌路旗舰店,69,69,19,//menglufs.tmall.com,52,51,51,55,48,57,64,86,74,81,75,63,79,69
231,天天特价欧洲站紧身破洞牛仔裤女刺绣潮流补丁铅笔裤显瘦小脚长裤价格：180,小马奔腾品质牛仔,69,69,18,//shop115893988.taobao.com,,,,,,,,,24,66,59,69,62,69
232,尚驭牛仔短裤女夏中腰宽松大码破洞学生显瘦卷边直筒牛仔裤女热裤价格：158,尚驭服饰旗舰店,69,69,19,//whshangyu.tmall.com,132,126,126,115,106,103,111,89,103,80,101,90,87,69
233,破洞牛仔裤女九分裤2017夏季新款高腰显瘦紧身弹力毛边小脚铅笔裤价格：138,蒙奴莎官方店,68,68,15,//mengnusha.taobao.com,51,48,48,39,47,44,43,63,48,54,35,43,33,68
234,显瘦牛仔裤女九分裤小脚裤2017春夏季新款铅笔裤长裤刺绣女裤子秋价格：129,艾妃尼思服饰旗舰店,68,68,20,//aifeinisi.tmall.com,,,,,,,,,,29,25,36,40,68
235,秋季新款黑色高腰膝盖破洞牛仔裤女九分裤紧身显瘦毛边9分小脚裤价格：128,BANANA原创牛仔设计,68,68,22,//shop127330067.taobao.com,,,,,,,,,40,42,41,61,74,68
236,七分牛仔裤女夏季薄款弹力显瘦小脚大码破洞马裤五分中裤学生短裤价格：99,娜馨旗舰店,67,67,21,//naxinfs.tmall.com,87,87,87,103,87,102,74,81,96,82,86,78,81,67
237,牛仔裤高腰2017新款春夏季九分显瘦学生韩版铅笔女士弹力小脚长裤价格：100,雅羊人旗舰店,67,68,26,//yayangren.tmall.com,,,,,,,,,39,41,33,54,53,67
238,黑色膝盖大破洞显瘦修身弹力高腰小脚铅笔九分牛仔裤女9分乞丐夏价格：69,92淘吧,67,69,20,//92taoba.taobao.com,56,42,42,40,50,34,38,48,41,40,38,62,62,67
239,2017秋夏季新款黑色膝盖破洞九分牛仔裤女韩版修身显瘦小脚长裤子价格：109,韩国范 沫儿时尚女装,66,68,19,//shop114189449.taobao.com,,,,24,34,34,48,47,43,56,66,82,80,66
240,高腰牛仔裤女2017春夏季秋季新款韩版女裤薄款长裤显瘦小脚铅笔裤价格：178,rky旗舰店,66,66,21,//rkynz.tmall.com,64,57,57,114,64,48,71,50,65,52,64,61,60,66
241,高腰牛仔裤女九分裤夏季薄款2017新款显瘦小脚长裤胖mm大码铅笔裤价格：168,尚大优品,66,66,21,//shop314615714.taobao.com,41,40,40,49,59,49,77,76,74,46,62,54,42,66
242,高腰弹力九分牛仔裤女秋夏季新款韩版学生修身显瘦小脚铅笔长裤子价格：74,第四十九天 49t,65,65,20,//shop136501012.taobao.com,,,,,,,50,57,52,60,58,84,76,65
243,牛仔七分裤女夏2017新款 薄款高腰松紧腰显瘦大码胖mm中裤五分裤价格：139,琳宛旗舰店,65,65,18,//linwan.tmall.com,82,88,88,86,98,88,80,92,96,88,56,80,83,65
244,2017夏季新款白色破洞牛仔女修身显瘦弹力紧身休闲大码外穿短裤子价格：89,妙曼伊菲儿,65,66,21,//shop128354197.taobao.com,205,191,191,154,154,155,178,161,139,98,108,115,74,65
245,尚驭牛仔裤女铅笔裤2017秋季新款弹力修身显瘦破洞紧身小脚裤长裤价格：328,尚驭服饰旗舰店,65,65,15,//whshangyu.tmall.com,52,62,62,70,67,67,71,72,68,57,64,49,63,65
246,高腰流苏牛仔裤女九分裤秋装春夏季2017新款韩版百搭显瘦小脚长裤价格：118,心计划旗舰店,65,65,13,//xinjihua.tmall.com,52,37,37,49,36,63,43,52,45,51,57,76,66,65
247,买一送一高腰牛仔短裤女2017新款春季韩版显瘦百搭学生超短裤女夏价格：79,皇朝御纺旗舰店,64,64,31,//huangchaoyufang.tmall.com,340,252,252,381,403,346,425,358,389,319,288,137,107,64
248,买一送一  秋季新品高腰弹力小脚裤价格：99,斯酷服饰,64,64,19,//shop144773796.taobao.com,,,,,,,,,,,,,,64
249,韩版女装包脚拉毛破洞水洗牛仔裤女修身显瘦紧身铅笔裤九分裤子潮价格：29.9,月牙城,64,64,16,//yueyacheng.taobao.com,44,31,31,35,40,39,44,68,50,65,65,63,71,64
250,牛仔裤女七分裤夏季韩版显瘦7分裤薄款中裤大码热裤2017新款女裤价格：198,娇宣尼旗舰店,63,63,21,//jiaoxuanni.tmall.com,82,83,83,41,28,49,42,45,36,31,42,63,70,63
251,俞兆林高腰牛仔七分裤女夏新款小脚铅笔裤薄7分牛仔裤女中裤潮价格：118,曼岛服饰专营店,63,64,38,//mandaofs.tmall.com,35,42,42,32,10,35,15,41,42,25,42,41,39,63
252,2017新款松紧腰牛仔短裤女夏韩版高腰薄款毛边热裤修身显瘦翻边裤价格：258,艾酷佳人女装品牌店,63,66,40,//ak788.taobao.com,212,189,189,174,211,186,127,139,131,93,87,100,62,63
253,2017韩版新款高腰修身显瘦弹力小脚裤九分裤毛边铅笔女秋季牛仔裤价格：298,h荷,63,64,21,//weibo99.taobao.com,,,,,,,,36,,,30,45,55,63
254,ONLY夏新磨破毛边小脚九分牛仔裤女|117249517价格：549,ONLY官方旗舰店,63,63,15,//only.tmall.com,20,19,19,52,33,31,13,24,18,32,17,15,11,63
255,2017春季新款烟灰色百搭破洞牛仔裤女韩版小脚高腰九分裤学生潮秋价格：118,匹克玛旗舰店,63,63,15,//pikema.tmall.com,55,62,62,43,58,47,52,46,50,49,35,59,69,63
256,2017明星同款高腰黑色紧身牛仔裤女九分毛边开叉小脚裤显瘦韩版潮价格：89,依沐蓝旗舰店,62,62,21,//yimulan.tmall.com,,,,,,,,,,27,51,40,39,62
257,高腰烟灰色牛仔裤女夏小脚修身铅笔潮流薄款bf风紧身黑色九分裤子价格：128,晶彩日韩女装,62,62,80,//shop224859407.taobao.com,,,,,,,,,,,40,60,63,62
258,大码高腰薄款牛仔裤女夏宽松九分裤弹力显瘦女士胖mm潮长裤200斤价格：99,GO酷时尚牛仔坊,62,62,27,//gocoolsh.taobao.com,71,62,62,41,81,62,73,69,72,59,68,54,67,62
259,黑色膝盖破洞牛仔裤女九分裤夏薄款韩版高腰显瘦不规则紧身小脚裤价格：288,女主角春夏装,62,62,20,//shop67920509.taobao.com,,,,42,,,,36,35,27,36,37,66,62
260,天天特价夏季韩版外穿短裤薄款高腰弹力女超短裤学生紧身牛仔热裤价格：88,普洛米亚折扣店,62,64,29,//shop120391013.taobao.com,129,101,101,74,105,84,92,74,81,86,84,144,59,62
261,韩版显瘦女裤紧身薄款牛仔裤女夏季裤子春新款夏小脚长裤2017破洞价格：79,思嘉怡牛仔裤,61,61,21,//shop110089847.taobao.com,104,83,83,106,84,82,92,112,84,86,56,70,72,61
262,牛仔裤女夏小脚高腰韩版2017春秋季新款学生九分裤修身显瘦铅笔裤价格：105,蓉媛旗舰店,61,61,18,//rongyuan.tmall.com,28,,,41,37,36,39,32,46,42,41,52,40,61
263,弹力韩版九分牛仔裤女春夏季2017新款学生小脚修身显瘦高腰铅笔裤价格：79,广州布衣布舍,61,61,22,//shop102311603.taobao.com,80,89,89,61,52,39,65,69,74,45,80,62,63,61
264,牛仔裤女九分裤小脚春夏秋季2017新款弹力破洞显瘦铅笔裤子韩版潮价格：98,怜雪服饰旗舰店,61,61,19,//lianxuefs.tmall.com,26,32,32,32,51,49,41,65,75,79,53,29,51,61
265,春夏装加肥加大码高腰胖mm乞丐破洞九分牛仔裤女装宽松小脚长裤潮价格：99,胖MM大购物,61,62,24,//shop110089612.taobao.com,58,56,56,51,53,53,49,45,45,38,49,56,53,61
