391,聚ONLY2017夏装新品修身高腰紧身牛仔裤女|117132505价格：549,ONLY官方旗舰店,43,43,26,//only.tmall.com,,,,,,,,,,,,,,391
392,黑色牛仔裤女长裤2017春夏季新款潮小脚乞丐显瘦紧身烂破洞铅笔裤价格：199,舒美舒漫,43,43,24,//smsyniuzaiku.taobao.com,471,278,278,498,410,488,374,370,490,431,471,425,498,392
393,2017秋季新款春夏破洞牛仔裤女长裤小脚裤韩版女士修身显瘦铅笔裤价格：328,晚烟旗舰店,43,43,16,//wanyanfs.tmall.com,260,340,340,326,350,492,291,314,362,401,448,354,382,393
394,2017新款韩版破洞学生牛仔裤短裤女夏弹力中腰百搭显瘦热裤子薄潮价格：79,惠茜牛仔,42,42,27,//huixi66.taobao.com,252,322,322,266,291,418,377,487,484,311,390,498,442,401
395,2017秋季新款韩版紧身黑色牛仔裤女小脚弹力显瘦铅笔裤修身长裤潮价格：239,梅玲龙旗舰店,42,42,24,//meilinglong.tmall.com,,,,,,,,,,401,,373,486,395
396,天天特价春夏季新款刺绣牛仔裤女九分裤韩版小脚裤个性显瘦裤子潮价格：128,丽丽家牛仔,42,42,20,//shop122471076.taobao.com,,,,,,,,,,,,,397,396
397,破洞牛仔裤女裤子九分春夏季2017新款韩版学生显瘦小脚黑色打底裤价格：199,比丽福旗舰店,42,42,19,//bilifu.tmall.com,,,,,,,,,,,,,377,397
398,牛仔裤女秋季2017新款松紧腰高腰九分裤显瘦大码女裤子胖mm夏长裤价格：159,蜜糖之城服饰旗舰店,42,42,19,//mitangzhicheng.tmall.com,483,288,288,346,307,372,487,,382,446,491,404,420,398
399,Vero Moda2017秋季新品基础款设计九分小脚牛仔裤|317349502价格：379,veromoda官方旗舰店,42,42,21,//veromoda.tmall.com,,247,247,,,,411,107,110,477,,,,399
400,白色牛仔裤女春2017新款长裤韩版显瘦小脚裤夏季铅笔裤九分裤薄价格：169,芳芳之佳旗舰店,42,43,29,//fangfangzhijia.tmall.com,420,446,446,355,374,,346,484,388,494,428,389,427,407
401,CBC2017春夏超高弹力牛仔短裤女浅蓝色卷边韩版修身显瘦高腰热裤价格：248,cobcbc服饰旗舰店,42,42,27,//cobcbc.tmall.com,337,491,491,368,364,339,476,283,487,335,393,324,391,410
402,妖精的口袋W阅读时长秋装2017新款破洞微喇叭牛仔裤女九分裤子价格：249,妖精的口袋旗舰店,42,42,22,//yaojingdekoudai.tmall.com,,,,,,,,,,,,,,402
403,夏秋薄款高腰牛仔裤女九分裤chic韩版紧身毛边学生百搭小脚铅笔裤价格：108,T淘气牛仔,42,42,24,//shop150025165.taobao.com,,,,,,,,,,,,,411,412
404,2017春夏新款大码女士高腰牛仔裤女九分裤胖mm弹力显瘦小脚铅笔裤价格：138,开口笑fushi,41,42,21,//shop108178186.taobao.com,327,343,343,,254,257,473,422,297,421,304,271,290,404
405,弹力新款春夏女士韩版中腰秋牛仔长裤薄款学生女显瘦小脚铅笔裤女价格：96,依美啦牛仔裤专家,41,42,30,//yimeila.taobao.com,301,487,487,369,474,493,345,440,478,353,415,362,390,405
406,破洞牛仔裤女春夏季2017新款薄款韩版不规则九分裤修身显瘦小脚裤价格：168,伊华蔻旗舰店,41,41,20,//evacoco.tmall.com,,315,315,478,411,344,499,479,406,488,451,448,429,406
407,Dnvie黑色高腰小脚牛仔裤女2017新款春秋显瘦韩版潮百搭紧身长裤价格：299,dnvie旗舰店,41,41,48,//dnvie.tmall.com,,,,,,,,,,,,,237,407
408,牛仔裤女九分裤2017春夏新款破洞卷边韩版高腰紧身显瘦小脚铅笔裤价格：253,索依巴旗舰店,41,42,29,//suoyiba.tmall.com,,,,,,278,440,479,487,404,366,296,418,408
409,俞兆林七分牛仔裤女 夏季2017新款高腰弹力百搭薄款小脚7分裤女潮价格：118,曼岛服饰专营店,41,41,30,//mandaofs.tmall.com,,4,4,8,155,335,455,420,448,390,155,382,423,422
410,2017夏秋新款破洞高腰牛仔裤女直筒修身显瘦小脚裤九分裤薄款宽松价格：196,迪尼姆旗舰店,41,41,34,//dinimu.tmall.com,,,,,,,,,177,396,,,,410
411,显瘦牛仔裤女长裤小脚裤2017春夏季新款秋装韩版潮高腰薄款女裤子价格：129,雅来特旗舰店,41,41,26,//yalaite.tmall.com,270,233,233,221,257,284,446,349,355,404,403,269,,411
412,佐丹奴牛仔裤 女装精工猫须洗水弹力棉修身显瘦窄脚裤女05416027价格：260,佐丹奴官方旗舰店,41,42,33,//giordano.tmall.com,,320,320,,,,,,,,,,,458
413,M初棉2017夏装新款前短后长九分牛仔裤女 弹力修身牛仔九分裤女价格：169,初棉旗舰店,41,41,21,//chumian.tmall.com,424,,,,401,311,469,,,484,,,401,413
414,15夏秋14少女裤13初中学生16岁女孩松紧腰长裤铅笔小脚牛仔裤加长价格：118,秦淮霓裳裤子店,40,40,32,//kuzhuangdian.taobao.com,,,,,,479,,438,438,416,,,413,425
415,牛仔裤女夏季薄款九分裤2017新款高腰修身显瘦韩版学生小脚长裤子价格：169.8,依情蜜语,40,40,30,//pwp1.taobao.com,,,,405,322,357,283,385,383,451,397,457,366,426
416,黑色膝盖破洞牛仔裤女九分裤新款韩版高腰显瘦弹力毛边小脚铅笔裤价格：168,潮依裤CYK,40,40,21,//yueranniuzai.taobao.com,,,,460,472,,455,,426,441,,453,496,430
417,2017春秋新款黑色牛仔裤女弹力小脚修身显瘦紧身韩版学生铅笔九分价格：148,伍尔柒服饰旗舰店,40,41,19,//wuerqi.tmall.com,441,478,478,409,492,385,465,365,406,447,365,457,355,417
418,伊芙丽2017新款韩版春夏季百搭显瘦铅笔裤破洞牛仔裤女九分裤价格：598,伊芙丽官方旗舰,40,40,25,//eifini.tmall.com,146,389,389,,130,225,256,362,,445,291,,,463
419,春季新款松紧腰胖MM大码弹力紧身收腹小脚学生高腰牛仔裤女长裤价格：150,纯纯牛仔屋,40,47,28,//shop113661458.taobao.com,,424,424,356,442,476,378,403,432,343,402,349,346,419
420,高腰黑色膝盖破洞牛仔裤女九分小脚铅笔长裤弹力修身显瘦BF乞丐裤价格：399,嘉汇旗舰店,40,40,15,//jiahuifs.tmall.com,,,,,479,348,459,,337,495,492,390,,420
421,3711 秋季新款韩版高弹力牛仔裤女黑色修身高腰打底裤小脚裤潮价格：22.99,第六神话华玉美衣女装成衣性价比之王外贸批发零售,40,44,25,//thesixthmyths.taobao.com,,,,,,,,,,,,,,421
422,高腰牛仔裤女小脚裤弹力显瘦学生长裤修身春秋新款排扣紧身大码潮价格：249,澜克利莎折扣店,40,41,22,//nz2010.taobao.com,484,,,359,287,255,393,250,385,368,460,351,399,422
423,Five Plus2017新品女夏装棉质洗水破洞小脚牛仔裤长裤2JM2061290价格：599,fiveplus官方旗舰店,40,40,23,//fiveplus.tmall.com,,,,,422,,,,,,,,,423
424,【天天特价】韩高腰膝盖破洞牛仔裤女生九分裤弹力紧身小脚铅笔裤价格：286,优衣裤祺舰店,40,42,24,//shop144299115.taobao.com,,,,,,,,,,,,,,424
425,【今天特价】韩秋冬紧身弹力显瘦高腰铅笔九分裤黑色小脚牛仔裤女价格：298,h荷,39,39,29,//weibo99.taobao.com,279,,,,,445,,,,,,,443,425
426,牛仔裤女九分裤高腰修身显瘦百搭长裤小脚裤侧边开叉铅笔裤休闲裤价格：39,小宅女大购物 xiaozhainv 小宅女家 xiao zhai nv,39,39,34,//zhainvjia.taobao.com,,,,,,,450,,458,483,,445,,426
427,3725 秋季新款韩版破洞毛边猫爪牛仔裤女黑色高弹力修身小脚裤潮价格：22.99,第六神话华玉美衣女装成衣性价比之王外贸批发零售,39,43,26,//thesixthmyths.taobao.com,,,,,,,,,,,,,,427
428,2017春装韩版女装高腰破洞牛仔裤女修身显瘦小脚铅笔裤乞丐九分裤价格：47,梦露日记时尚女装,39,39,16,//mengluriji.taobao.com,,415,415,,381,295,305,352,272,378,306,500,314,428
429,A＋B黑色牛仔裤女夏韩版高腰2017新款薄款九分裤小脚弹力铅笔显瘦价格：188,ab服饰旗舰店,39,39,22,//abfs.tmall.com,,,,,,431,376,417,315,224,210,467,341,436
430,夏薄款破洞牛仔裤女九分裤韩版高腰不规则毛边弹力显瘦小脚铅笔裤价格：159,时尚起义牛仔,39,41,12,//shop140964908.taobao.com,163,355,355,342,294,436,422,257,348,433,375,454,360,437
431,韩版高腰牛仔裤女夏小脚裤加长裤黑色大码胖mm显瘦弹力铅笔裤九分价格：128,蝴蝶女神Lucky goddess,39,39,33,//shop101570543.taobao.com,256,259,259,212,170,151,190,230,244,274,235,233,368,431
432,高腰牛仔短裤女宽松显瘦韩版学生百搭2017春夏季新款破洞阔腿热裤价格：126,雅来特旗舰店,39,39,28,//yalaite.tmall.com,403,363,363,469,422,421,,466,,428,473,388,432,432
433,ONLY2017夏装新品修身高腰含棉牛仔裤女|117132507价格：499,ONLY官方旗舰店,39,39,30,//only.tmall.com,,,,297,,453,,,,,,,,433
434,宽松破洞牛仔裤女九分裤显瘦烂乞丐裤韩版潮2017春夏季新款女裤子价格：198,雅来特旗舰店,39,39,20,//yalaite.tmall.com,,,,484,,350,,,437,484,442,497,497,476
435,2017新款牛仔裤女九分裤春夏季显瘦弹力高腰百搭小脚铅笔裤韩版潮价格：128,颜茹旗舰店,39,39,19,//yanru.tmall.com,294,363,363,386,402,453,380,392,375,420,408,439,350,435
436,牛仔裤女长裤显瘦小脚裤2017秋季新款韩版修身铅笔裤刺绣裤子女裤价格：139,娇宣尼旗舰店,38,38,28,//jiaoxuanni.tmall.com,,,,,,,,,,400,450,376,374,436
437,【地球店】给你大长腿！重工水洗手工装饰钉黑色毛边牛仔小短裤价格：368,AVIVA 地球店,38,38,16,//aviva-j.taobao.com,,192,192,296,304,310,227,363,224,265,297,288,302,437
438,kumayes 夏秋新款撕边缺口抓纹修身小脚裤韩版高腰显瘦牛仔九分裤价格：69,kumayes,38,38,13,//kumayes.taobao.com,,,,,,,,,,,,,,438
439,2017春夏季韩版破洞牛仔裤女黑色修身高腰长裤小脚铅笔显瘦九分裤价格：99,初牛旗舰店,38,38,34,//chuniu.tmall.com,,,,,,,,471,,,,,,439
440,2017春夏季新款黑色牛仔裤女韩版九分裤学生铅笔裤高腰小脚长裤子价格：99,本真之美旗舰店,38,38,26,//benzhenzhimei.tmall.com,,,,,,,,,,,,438,,445
441,破洞牛仔裤女2017春夏季新款宽松bf哈伦裤子薄显瘦钉珠大码九分裤价格：298,怡斐尚旗舰店,38,38,19,//yifeishangnz.tmall.com,456,472,472,349,333,296,447,388,454,427,292,399,357,447
442,烂白色牛仔裤女长裤春夏季2017新款韩版秋显瘦小脚铅笔裤女破洞潮价格：259,舒美舒漫,38,39,23,//smsyniuzaiku.taobao.com,465,441,441,392,355,417,471,394,442,438,453,415,499,442
443,2016韩版女装新款破洞牛仔裤女修身显瘦高腰紧身小脚铅笔裤子长裤价格：36.8,月牙城,37,38,23,//yueyacheng.taobao.com,177,434,434,444,402,353,287,492,456,460,347,344,364,443
444,牛仔裤女长裤薄款秋装2017新款显瘦小脚松紧腰春夏季九分裤女裤子价格：129,左街右巷女裤  微时尚,37,37,27,//haochongchangzai.taobao.com,386,259,259,324,190,464,467,298,348,405,342,358,369,444
445,2017新款韩版大码修身高腰弹力显瘦小脚长裤紧身铅笔牛仔裤包邮价格：199,格秋旗舰店,37,37,20,//geqiu.tmall.com,,,,419,467,,418,236,298,347,251,370,344,445
446,破洞烂牛仔裤女夏高腰九分裤学生2017新款韩版潮紧身膝盖破洞长裤价格：129,皇朝御纺旗舰店,37,37,74,//huangchaoyufang.tmall.com,,,,,,,,,,,,,481,446
447,春夏季新款bf前后破洞牛仔裤女哈伦裤宽松显瘦九分毛边乞丐垮裤潮价格：180,云上生活 明星小艺人,37,38,21,//shop114462765.taobao.com,373,285,285,499,372,428,375,452,434,442,414,490,342,447
448,聚ONLY2017夏新含天丝磨白小脚修身牛仔裤女|117249540价格：449,ONLY官方旗舰店,37,37,29,//only.tmall.com,240,,,482,90,128,199,,390,175,,,,448
449,韩国女装代购 2017秋装新款 磨白抓痕毛边显瘦直筒九分牛仔裤价格：186,cathy studio韩国女装,37,37,7,//hoho--cathy.taobao.com,112,132,132,42,61,37,53,25,16,23,48,18,14,449
450,灰色高腰短裤夏女2017新款韩版牛仔修身显瘦大码胖mm百搭裤子潮价格：99,冰仙子 衣橱,37,37,22,//bxianzi.taobao.com,179,217,217,225,256,248,379,249,307,398,361,240,256,450
451,韩版黑色高腰破洞牛仔裤女九分小脚裤大码弹力显瘦学生加长铅笔裤价格：128,蝴蝶女神Lucky goddess,37,37,42,//shop101570543.taobao.com,333,427,427,283,278,293,430,198,395,,400,365,433,451
452,【88聚249元】ochirly欧时力磨破中腰棉质牛仔长裤1JJ1061400价格：499,ochirly官方旗舰店,37,37,30,//ochirly.tmall.com,,,,,,,,,,,,,,452
453,天天特价萝卜牛仔裤女秋季宽松高腰九分裤学生装休闲长裤小脚裤女价格：109,蒙特尔服装店,37,37,19,//yy2688.taobao.com,,,,,,,,,,,,,500,453
454,夏季薄款弹力小脚铅笔裤乞丐九分裤高腰显瘦黑色膝盖破洞牛仔裤女价格：139,时商界,37,37,28,//shop110741467.taobao.com,285,265,265,296,343,479,306,341,472,266,380,413,356,463
455,秋季新品松紧腰牛仔大码小脚女修身显瘦胖mm高腰弹力韩版长裤价格：199,斯酷服饰,37,37,22,//shop144773796.taobao.com,,,,,,,,,,,,,82,455
456,太平鸟女装2017夏装新款网纱绣花拼接牛仔裤毛边牛仔长裤铅笔裤女价格：499,太平鸟官方旗舰店,37,37,36,//pb89.tmall.com,,,,,,,,,,,,,,456
457,复古港味chic风修身显瘦高腰撕边紧身牛仔裤女烟灰色小脚铅笔裤子价格：38,港妹潮人馆,37,37,26,//bazhaoyi.taobao.com,,,,435,,478,394,393,396,,,368,257,457
458,瓦q牛仔裤女春夏季2017新款九分裤韩版高腰显瘦小脚裤秋装铅笔裤价格：199,瓦q旗舰店,37,37,20,//wati.tmall.com,,,,,,,,,,,373,369,362,458
459,执念秋冬新款高腰牛仔裤女小脚铅笔裤韩版排扣修身显瘦长裤学生潮价格：99,执念旗舰店,37,37,23,//zhinian.tmall.com,489,412,412,441,400,407,335,350,398,469,407,379,459,459
460,黑色膝盖破洞牛仔裤女2017夏秋韩版弹力紧身显瘦学生修身九分小脚价格：249,加勒比服装有限公司,36,36,124,//shop142888552.taobao.com,,,,,,,,,,,,,,460
461,逸阳女裤2017夏季新款白色破洞牛仔裤女九分裤宽松八分小脚裤薄款价格：169,逸阳蕴美专卖店,36,36,25,//eseyym.tmall.com,353,276,276,,492,391,,456,,461,,397,,461
462,【天天特价】秋季韩版显瘦糖果彩色铅笔裤弹力小脚休闲裤牛仔裤女价格：128,[雅蔓阁],36,37,31,//shop104404392.taobao.com,319,,,,352,482,449,487,475,365,285,357,447,462
463,秋季新款复古高腰膝盖破洞牛仔裤女九分裤紧身显瘦弹力小脚铅笔裤价格：228,西瓜家女装定制,36,65,44,//shop63234190.taobao.com,,,,,,,,,,,,,,463
464,杨幂同款裤子欧阳娜娜显瘦不规则开叉黑色高腰牛仔裤女九分小脚裤价格：148,南都之美,36,36,19,//nandouzhimei.taobao.com,,,,,435,,383,435,,,,,479,466
465,逸阳女裤2017新款时尚毛边七分牛仔裤女夏薄款修身显瘦弹力小直筒价格：169,esey逸阳名郎专卖店,36,36,28,//eseyml.tmall.com,142,208,208,255,339,367,472,437,496,188,395,347,480,469
466,显瘦秋装新款百搭高腰牛仔裤秋季小脚铅笔女裤子2017女士韩版长裤价格：198,柏诗雅旗舰店,36,40,60,//baishiya.tmall.com,,,,,,,,,,,,456,,466
467,牛仔裤女春夏季2017新款韩版高腰紧身秋季显瘦铅笔小脚薄款九分裤价格：108,芮丽娅旗舰店,36,36,23,//ruiliya.tmall.com,197,445,445,478,303,414,481,390,,,478,,,467
468,春夏薄款弹力紧身浅色牛仔裤女长裤韩国九分小脚铅笔裤修身牛子裤价格：85,沐妤衣舍,36,36,16,//shop116304064.taobao.com,414,437,437,395,407,355,318,395,367,350,323,231,354,468
469,春夏装新款浅色牛仔裤女士显瘦韩版小脚裤学生弹力修身中腰长裤子价格：198,牛仔girl女裤,36,36,30,//niuzaigirl.taobao.com,415,478,478,288,343,279,384,409,364,351,368,384,486,469
470,逸阳女裤2017新款夏牛仔裤女毛边小脚裤八分裤韩版铅笔裤2015价格：179,逸阳巨米专卖店,36,36,25,//eseyjm.tmall.com,,404,404,495,413,413,466,498,359,469,452,,431,470
471,2017夏季膝盖破洞牛仔裤女紧身弹力显瘦小脚学生九分乞丐铅笔裤潮价格：88,东门女装衣柜,36,36,36,//shop125537505.taobao.com,251,426,426,,316,323,414,441,448,,,373,,471
472,聚ONLY夏装新品褶皱装饰口袋低腰修身小脚牛仔裤女|116332512价格：399,ONLY官方旗舰店,36,36,33,//only.tmall.com,,,,468,91,168,,,,,,,,472
473,七分裤女夏季牛仔裤显瘦铅笔裤7分薄款高腰松紧腰大码五分裤中裤价格：139,贝莎莱旗舰店,36,36,26,//beishalai.tmall.com,438,199,199,470,139,475,187,201,151,110,126,453,473,473
474,2017夏装新款韩版高腰显瘦翻边弹力小脚九分牛仔裤女薄款中裤B83价格：65.9,百分着衣,36,36,13,//shop69667879.taobao.com,316,485,485,350,351,,409,389,386,444,294,392,361,474
475,2017新款春季牛仔裤女秋款小脚裤春秋长裤潮弹力紧身百搭女士裤子价格：188,造上服饰旗舰店,36,36,23,//zaoshang.tmall.com,,486,486,471,398,465,414,379,,,442,,486,475
476,Vero Moda2017夏季新品水洗系扣高腰七分小脚牛仔裤|31726I515价格：479,veromoda官方旗舰店,36,36,29,//veromoda.tmall.com,,471,471,,,,435,220,241,,,,,476
477,聚ONLY早秋含棉修身磨破做旧小脚牛仔裤女|116332520价格：399,ONLY官方旗舰店,36,36,26,//only.tmall.com,,,,,,,,,,,,,,477
478,2017夏季韩版破洞高腰修身九分牛仔裤女学生显瘦弹力小脚铅笔长裤价格：89,GMCJ 国民潮姐,35,35,33,//shop107728152.taobao.com,337,247,247,322,331,185,247,296,280,472,391,412,461,478
479,破洞牛仔裤女春季2017新款夏装裤子韩版显瘦小脚裤学生高腰九分裤价格：119,右风左岸旗舰店,35,35,18,//youfengzuoan.tmall.com,338,,,,432,447,,,440,,349,,,479
480,牛仔裤女夏季2017新款渔网破洞显瘦乞丐裤翻边休闲九分小脚铅笔裤价格：38.8,可人时尚服饰低价优质,35,36,22,//88208.taobao.com,,,,,,,,436,,366,500,345,426,480
481,韩都衣舍2017韩版女装夏装新款弹力修身小脚毛边牛仔裤OU6847蚣鄹瘢258,韩都衣舍旗舰店,35,35,14,//handuyishe.tmall.com,232,414,414,350,394,486,442,384,,54,81,73,222,481
482,牛仔裤女九分裤夏2017新款韩版高腰显瘦黑色破洞小脚裤学生秋装潮价格：128,蕾媛旗舰店,35,35,28,//leiyuannz.tmall.com,,,,,,,,,,,,,392,482
483,春夏季韩版膝盖破洞黑色修身牛仔裤女小脚铅笔乞丐裤九分裤子价格：256,艾斯马服饰旗舰店,35,35,45,//isimar.tmall.com,,,,,,,,,,,,,478,483
484,逸阳女裤2017新款夏七分牛仔裤女宽松短裤7分小脚马裤中裤子薄款价格：159,逸阳颜冉专卖店,35,35,32,//eseyyr.tmall.com,500,494,494,424,154,156,257,204,167,400,377,179,227,484
485,逸阳女裤2017夏新款高腰牛仔裤女小脚裤大码薄弹力韩版铅笔九分裤价格：159,逸阳雅尔达专卖店,35,36,23,//yiyangyed.tmall.com,336,359,359,366,486,380,422,,,380,377,343,402,485
486,高腰牛仔裤女九分裤小脚春夏季2017新款弹力破洞显瘦韩版铅笔裤子价格：108,蓉媛旗舰店,35,35,26,//rongyuan.tmall.com,,444,444,397,346,,488,,,,,,,486
487,2017新款秋季韩版高腰牛仔裤女九分裤紧身显瘦学生弹力小脚铅笔裤价格：168,伊卡儿牛仔馆,35,36,19,//shop136912963.taobao.com,426,310,310,,264,,341,462,441,,,,338,487
488,2017年秋款韩版高腰九分牛仔裤女小脚弹力显瘦铅笔裤卷边学生长裤价格：168,韩刻旗舰店,35,35,33,//hankefs.tmall.com,,,,,,,,,,,,,,488
489,松紧腰带牛仔裤女七分裤高腰显瘦春夏季胖mm大码小脚中裤薄款长裤价格：369,AF时尚屋,35,38,42,//afssw.taobao.com,296,,,487,353,,377,,,398,478,494,409,490
490,夏季薄款bf风韩版修身小脚牛仔裤女高腰显瘦九分裤铅笔裤长裤子秋价格：120,小小鹿晗迷,35,35,28,//shop406972329.taobao.com,,,,,,398,394,288,276,456,482,424,423,490
491,阔色2017秋装新款韩版女装chic紧身显瘦黑色小脚裤长裤牛仔裤预售价格：197,kuose阔色旗舰店,34,34,12,//kuose.tmall.com,358,,,349,449,361,423,,,99,285,428,376,491
492,牛仔裤女秋季2017新款高腰长裤紧身韩版显瘦小脚裤铅笔裤女裤裤子价格：109,芮丽娅旗舰店,34,34,23,//ruiliya.tmall.com,,,,,,440,363,449,459,317,338,376,301,492
493,2017秋季新款牛仔裤女士修身显瘦小脚裤韩版弹力铅笔裤女长裤子潮价格：149,西孚旗舰店,34,34,35,//xifufs.tmall.com,322,337,337,396,412,412,412,408,317,,463,481,461,493
494,伊芙丽2017春夏季新款直筒铅笔裤毛边牛仔裤女九分裤显瘦裤子女夏价格：399,伊芙丽官方旗舰,34,34,32,//eifini.tmall.com,200,493,493,,362,384,,,,,,,,494
495,韩版膝盖破洞长裤高腰弹力毛边牛仔裤女秋学生灰色修身常规铅笔裤价格：99,骞骞韩流风尚,34,35,26,//shop108794512.taobao.com,369,434,434,423,338,426,379,498,402,464,,460,,495
496,牛仔裤女春夏季九分裤2017新款韩版裤子显瘦秋装小脚裤长裤铅笔裤价格：80,册子小姐动漫制定,34,34,55,//shop156228261.taobao.com,,,,,,,,,,,,,465,496
497,秋装女装韩版弹力高腰破洞修身牛仔裤百搭铅笔裤九分裤休闲小脚裤价格：37.98,可可里小姐,34,34,24,//misskkl.taobao.com,394,357,357,458,310,311,443,299,315,380,449,478,,497
498,万年基础款 柔软舒服高弹胖mm 高腰女大码牛仔色九分小脚裤显瘦价格：99,小耳美衣,34,34,28,//sedney98989898.taobao.com,,,,,,,,,,,,,,498
499,春夏韩版黑色高腰牛仔裤女九分裤高弹力9分烟灰色小脚铅笔裤女潮价格：128,cherry私人订制服饰,34,34,26,//shop508352742.taobao.com,,,,,,,360,,,,,,,499
500,2017春夏季新款白色破洞牛仔裤女九分裤小脚裤宽松乞丐哈伦裤子潮价格：176,艾妃尼思服饰旗舰店,34,35,20,//aifeinisi.tmall.com,300,349,349,342,344,459,409,399,445,396,453,385,484,500